{
  "schemaVersion": "ysclaw.patch_regression_result.v1",
  "regressionId": "reg-matmul-001",
  "patchCandidateId": "pc-bp-riscv-matmul-cache-001",
  "status": "pass",
  "command": "agent1 patch_regression --case matmul-1024",
  "tests": [
    {
      "name": "matmul-1024",
      "status": "pass",
      "durationMs": 1240,
      "output": "运行时间改善 12%"
    }
  ],
  "artifacts": ["reports/matmul-1024.json"],
  "summary": "回归通过，目标测试用例已改善。"
}
